{
  "format": "quillville-picks",
  "version": 1,
  "updated": "2026-10-14T11:43:57Z",
  "title": "QuillVille Community Picks",
  "description": "Stations, podcasts and places the community recommends.",
  "collections": [
    {
      "id": "acb-media-streams",
      "title": "ACB Media (live)",
      "description": "ACB Media's live channels.",
      "items": [
        {
          "id": "acb-media-1",
          "type": "stream",
          "title": "ACB Media 1",
          "description": "ACB Media 1, live from ACB Media.",
          "language": "en",
          "stream_url": "https://streaming.live365.com/a11911",
          "added": "2026-08-25"
        },
        {
          "id": "acb-media-2",
          "type": "stream",
          "title": "ACB Media 2",
          "description": "ACB Media 2, live from ACB Media.",
          "language": "en",
          "stream_url": "https://streaming.live365.com/a27778",
          "added": "2026-08-25"
        },
        {
          "id": "acb-media-3",
          "type": "stream",
          "title": "ACB Media 3",
          "description": "ACB Media 3, live from ACB Media.",
          "language": "en",
          "stream_url": "https://streaming.live365.com/a17972",
          "added": "2026-08-25"
        },
        {
          "id": "acb-media-4",
          "type": "stream",
          "title": "ACB Media 4",
          "description": "ACB Media 4, live from ACB Media.",
          "language": "en",
          "stream_url": "https://streaming.live365.com/a89697",
          "added": "2026-08-25"
        },
        {
          "id": "acb-media-5",
          "type": "stream",
          "title": "ACB Media 5",
          "description": "ACB Media 5, live from ACB Media.",
          "language": "en",
          "stream_url": "https://streaming.live365.com/a46090",
          "added": "2026-08-25"
        },
        {
          "id": "acb-media-6",
          "type": "stream",
          "title": "ACB Media 6",
          "description": "ACB Media 6, live from ACB Media.",
          "language": "en",
          "stream_url": "https://streaming.live365.com/a36240",
          "added": "2026-08-25"
        },
        {
          "id": "acb-media-7",
          "type": "stream",
          "title": "ACB Media 7",
          "description": "ACB Media 7, live from ACB Media.",
          "language": "en",
          "stream_url": "https://streaming.live365.com/a95398",
          "added": "2026-08-25"
        },
        {
          "id": "acb-media-8",
          "type": "stream",
          "title": "ACB Media 8",
          "description": "ACB Media 8, live from ACB Media.",
          "language": "en",
          "stream_url": "https://streaming.live365.com/a18975",
          "added": "2026-08-25"
        },
        {
          "id": "acb-media-9",
          "type": "stream",
          "title": "ACB Media 9",
          "description": "ACB Media 9, live from ACB Media.",
          "language": "en",
          "stream_url": "https://streaming.live365.com/a44175",
          "added": "2026-08-25"
        },
        {
          "id": "acb-media-10",
          "type": "stream",
          "title": "ACB Media 10",
          "description": "ACB Media 10, live from ACB Media.",
          "language": "en",
          "stream_url": "https://streaming.live365.com/a85327",
          "added": "2026-08-25"
        }
      ]
    },
    {
      "id": "acb-media-podcasts",
      "title": "ACB Media (podcasts)",
      "description": "Everything ACB Media publishes as a podcast.",
      "items": [
        {
          "id": "acb-advocacy-update",
          "type": "podcast",
          "title": "ACB Advocacy Update",
          "description": "This feed provides updates from the American Council of the Blind on its advocacy efforts.",
          "feed_url": "https://pinecast.com/feed/acb-advocacy-update",
          "added": "2026-08-25",
          "language": "en",
          "homepage": "https://acb-advocacy-update.pinecast.co"
        },
        {
          "id": "acb-braille-forum-and-e-forum",
          "type": "podcast",
          "title": "ACB Braille Forum and E-Forum",
          "description": "The ACB Braille Forum is a magazine produced by the American Council of the Blind",
          "feed_url": "https://pinecast.com/feed/acb-braille-forum-and-e-forum",
          "added": "2026-08-25",
          "language": "en",
          "homepage": "https://acb-braille-forum-and-e-forum.pinecast.co"
        },
        {
          "id": "acb-business",
          "type": "podcast",
          "title": "ACB Business",
          "description": "ACB Board meetings and other ACB Business and Committee meetings open to the public.",
          "feed_url": "https://pinecast.com/feed/acb-business",
          "added": "2026-08-25",
          "language": "en-US",
          "homepage": "https://acb-business.pinecast.co"
        },
        {
          "id": "acb-community",
          "type": "podcast",
          "title": "ACB Community",
          "description": "Welcome to the ACB Media Community Podcast, home to content from ACB sponsored community events. Our community is growing and we want everyone to find their place in it. From technology to the kitchen, from hobbies and sports to exercise and meditation, and timely discussions to formal presentations, we now have a place to share, learn, and grow. Although most social events will not be shared on this feed, topic driven content will be, and we invite everyone to take part in this ACB community.",
          "feed_url": "https://pinecast.com/feed/acb-community",
          "added": "2026-08-25",
          "language": "en-US",
          "homepage": "https://acb-community.pinecast.co"
        },
        {
          "id": "acb-conference-and-convention",
          "type": "podcast",
          "title": "ACB Conference and Convention",
          "description": "ACB Conference and Convention materials and archives",
          "feed_url": "https://pinecast.com/feed/acb-convention",
          "added": "2026-08-25",
          "language": "en",
          "homepage": "https://acb-convention.pinecast.co"
        },
        {
          "id": "acb-convention-audio-described-tours",
          "type": "podcast",
          "title": "ACB Convention: Audio Described Tours",
          "description": "Welcome to the home of many of the Audio Described Tours that were presented during the ACB Virtual Conference and Convention.",
          "feed_url": "https://pinecast.com/feed/acb-ad-tours",
          "added": "2026-08-25",
          "language": "en-US",
          "homepage": "https://acb-ad-tours.pinecast.co"
        },
        {
          "id": "acb-convention-exhibits",
          "type": "podcast",
          "title": "ACB Convention: Exhibits",
          "description": "This Podcast Feed contains the Virtual Exhibits presented in the Virtual Exhibit Hall at the ACB Virtual Conference and Convention.",
          "feed_url": "https://pinecast.com/feed/acb-exhibits",
          "added": "2026-08-25",
          "language": "en-US",
          "homepage": "https://acb-exhibits.pinecast.co"
        },
        {
          "id": "acb-diabetics-in-action",
          "type": "podcast",
          "title": "ACB Diabetics in Action",
          "description": "Podcast feed for the ACB Diabetics in Action strategic initiative.",
          "feed_url": "https://pinecast.com/feed/acb-diabetics-in-action",
          "added": "2026-08-25",
          "language": "en-US",
          "homepage": "https://acb-diabetics-in-action.pinecast.co"
        },
        {
          "id": "acb-events",
          "type": "podcast",
          "title": "ACB Events",
          "description": "The ACB Events feed brings you events that have been streamed live on ACB Media.",
          "feed_url": "https://pinecast.com/feed/acb-events",
          "added": "2026-08-25",
          "language": "en",
          "homepage": "https://acb-events.pinecast.co"
        },
        {
          "id": "acb-focus-advocacy",
          "type": "podcast",
          "title": "ACB Focus: Advocacy",
          "description": "ACB Conference and Convention recordings of sessions of the Advocacy Track",
          "feed_url": "https://pinecast.com/feed/acb-focus-advocacy",
          "added": "2026-08-25",
          "language": "en-US",
          "homepage": "https://acb-focus-advocacy.pinecast.co"
        },
        {
          "id": "acb-focus-audio-description",
          "type": "podcast",
          "title": "ACB Focus: Audio Description",
          "description": "Welcome to the Audio Description Track of the ACB Focus Podcast Series. The Audio Description Track contains programming that involves the accessibility of the visual images of theater, television, movies, and other art forms for people who are blind, have low vision, or who are otherwise visually impaired.",
          "feed_url": "https://pinecast.com/feed/acb-audio-description",
          "added": "2026-08-25",
          "language": "en-US",
          "homepage": "https://acb-audio-description.pinecast.co"
        },
        {
          "id": "acb-focus-diversity-equity-and-inclusion",
          "type": "podcast",
          "title": "ACB Focus: Diversity, Equity, and Inclusion",
          "description": "Welcome to the ACB Diversity, Equity, and Inclusion Track of the ACB Focus Podcast Series. ACB embraces Diversity, Equity and Inclusion in our Core Values. ACB welcomes members of all nationalities, ethnicities, sexual orientations, religions, political affiliations, disabilities, ages, genders, gender identities, and other minority groups to fully respect and represent the blind and visually impaired community in all the work we do.",
          "feed_url": "https://pinecast.com/feed/acb-diversity-inclusion",
          "added": "2026-08-25",
          "language": "en-US",
          "homepage": "https://acb-diversity-inclusion.pinecast.co"
        },
        {
          "id": "acb-focus-education",